{
  "event_id": "evt_123",
  "timestamp": "2026-08-24T12:00:00Z",
  "device_id": "dev_123",
  "user_id": "alice@acme.com",
  "agent_session_id": "agt_123",
  "project_id": "atlas",
  "source": "ai_agent",
  "action": "credential.request",
  "resource": "aws-dev",
  "decision": "allow",
  "policy_ids": ["eng-ai-v3"],
  "result": "success"
}
